{
  "$schema": "https://json-schema.org/draft/2020-12/schema",
  "title": "avd-assessment-review/v1: a person's decision on each finding of one assessment (review.json)",
  "description": "Contract C23, written by avd-current-state's assessment portal. It pins the C21 report it reviews by hash and records, per check, what the reviewer decided: fix it, accept it with a reason, or defer it. Reasons are codes, never free text; a reviewer's notes stay in their private notes file. It holds no names or IDs, only the estate pseudonym and check IDs, and works without the brain or avd-swarm, which may import it (optional extensions only).",
  "type": "object",
  "required": ["schema", "estate", "reviewedOn", "assessment", "decisions"],
  "additionalProperties": false,
  "$defs": {
    "utc": { "type": "string", "pattern": "^[0-9]{4}-[0-9]{2}-[0-9]{2}T[0-9]{2}:[0-9]{2}:[0-9]{2}Z$" },
    "date": { "type": "string", "pattern": "^[0-9]{4}-[0-9]{2}-[0-9]{2}$" },
    "sha256": { "type": "string", "pattern": "^[0-9a-f]{64}$" }
  },
  "properties": {
    "$schema": { "type": "string" },
    "schema": { "const": "avd-assessment-review/v1" },
    "estate": { "type": "string", "pattern": "^est-[0-9a-f]{8}$", "description": "The same pseudonym as the C21 report" },
    "reviewedOn": { "$ref": "#/$defs/date" },
    "assessment": {
      "type": "object",
      "description": "The C21 report reviewed: the SHA-256 of its bytes and its generatedUtc",
      "required": ["sha256", "generatedUtc"],
      "additionalProperties": false,
      "properties": { "sha256": { "$ref": "#/$defs/sha256" }, "generatedUtc": { "$ref": "#/$defs/utc" } }
    },
    "decisions": {
      "type": "array",
      "description": "At most one row per check of the report (tests/check_contracts.py checks the examples for duplicates). A check with no row is not reviewed yet; a plan treats it as fix when its outcome isn't pass.",
      "items": {
        "type": "object",
        "required": ["check", "outcome", "disposition", "reason"],
        "additionalProperties": false,
        "properties": {
          "check": { "type": "string", "pattern": "^asm-[a-z0-9-]{3,60}$" },
          "outcome": { "enum": ["pass", "warn", "gap", "unknown"], "description": "The outcome the reviewer saw. A later report with a different outcome for the check asks for a new decision." },
          "disposition": { "enum": ["fix", "accept", "defer"] },
          "reason": { "enum": ["fix-planned", "cost", "compensating-control", "business-need", "not-applicable", "needs-evidence", "out-of-scope", "later-phase"] },
          "reviewBy": { "$ref": "#/$defs/date", "description": "Optional: when an accepted or deferred finding should be looked at again" },
          "carriedForward": { "type": "boolean", "description": "true when the portal copied this decision from an earlier review because the outcome didn't change; it asks for a second look" }
        },
        "allOf": [
          { "if": { "properties": { "disposition": { "const": "fix" } } }, "then": { "properties": { "reason": { "const": "fix-planned" }, "reviewBy": false } } },
          { "if": { "properties": { "disposition": { "const": "accept" } } }, "then": { "properties": { "reason": { "enum": ["cost", "compensating-control", "business-need", "not-applicable"] } } } },
          { "if": { "properties": { "disposition": { "const": "defer" } } }, "then": { "properties": { "reason": { "enum": ["needs-evidence", "out-of-scope", "later-phase"] } } } }
        ]
      }
    },
    "extensions": {
      "type": "object",
      "description": "Optional, for upper layers only, keyed by namespace (contracts/README.md rule 1). A foundation reader ignores it.",
      "propertyNames": { "pattern": "^[a-z][a-z0-9-]{1,30}$" }
    }
  }
}
