{
  "schema": "avd-assessment-review/v1",
  "estate": "est-0a1b2c3d",
  "reviewedOn": "2026-10-21",
  "assessment": { "sha256": "8b5f1f0e6b1c2a3d4e5f60718293a4b5c6d7e8f90a1b2c3d4e5f60718293a4b5", "generatedUtc": "2026-10-20T10:00:00Z" },
  "decisions": [
    { "check": "asm-personal-start-vm-on-connect", "outcome": "warn", "disposition": "fix", "reason": "fix-planned" },
    { "check": "asm-profile-storage-private-endpoint", "outcome": "pass", "disposition": "accept", "reason": "not-applicable", "carriedForward": true }
  ]
}
